{
  "$schema": "https://json-schema.org/draft/2020-12/schema",
  "title": "DPA Adapter",
  "description": "Data file defining one Data Protection Authority the complaint builder can target.",
  "type": "object",
  "required": ["id", "name", "country", "jurisdiction", "languages", "letterLanguage", "submission", "form", "enforcementFocus", "procedural"],
  "additionalProperties": false,
  "properties": {
    "id":            { "type": "string", "pattern": "^[a-z]{2}-[a-z0-9-]+$", "description": "Stable id, e.g. nl-ap, fr-cnil" },
    "name":          { "type": "string", "minLength": 2 },
    "country":       { "type": "string", "pattern": "^[A-Z]{2}$", "description": "ISO 3166-1 alpha-2" },
    "jurisdiction":  { "type": "string" },
    "languages":     { "type": "array", "items": { "type": "string", "pattern": "^[a-z]{2}$" }, "minItems": 1 },
    "letterLanguage":{ "type": "string", "pattern": "^[a-z]{2}$", "description": "Default language for the generated letter" },
    "submission": {
      "type": "object",
      "required": ["portalUrl", "acceptsEmail", "acceptsPost"],
      "additionalProperties": false,
      "properties": {
        "portalUrl":      { "type": "string", "format": "uri" },
        "acceptsEmail":   { "type": "boolean" },
        "email":          { "type": "string", "format": "email" },
        "acceptsPost":    { "type": "boolean" },
        "postalAddress":  { "type": "string" }
      }
    },
    "form": {
      "type": "object",
      "required": ["requiredFields", "fieldMapping", "attachmentsAccepted", "maxTotalAttachmentMB"],
      "additionalProperties": false,
      "properties": {
        "requiredFields":       { "type": "array", "items": { "type": "string" }, "minItems": 1 },
        "fieldMapping":         { "type": "object", "additionalProperties": { "type": "string" } },
        "attachmentsAccepted":  { "type": "array", "items": { "type": "string", "enum": ["pdf", "png", "jpg", "jpeg", "txt", "md", "csv", "json", "zip"] } },
        "maxTotalAttachmentMB": { "type": "integer", "minimum": 1 }
      }
    },
    "enforcementFocus": {
      "type": "array",
      "minItems": 1,
      "items": {
        "type": "object",
        "required": ["article", "weight"],
        "additionalProperties": false,
        "properties": {
          "article": { "type": "string" },
          "weight":  { "type": "string", "enum": ["high", "medium", "low"] }
        }
      }
    },
    "enforcementExamples": {
      "type": "array",
      "items": {
        "type": "object",
        "required": ["year", "target", "articles"],
        "additionalProperties": false,
        "properties": {
          "year":     { "type": "integer", "minimum": 2018 },
          "target":   { "type": "string" },
          "fine":     { "type": "string" },
          "articles": { "type": "array", "items": { "type": "string" }, "minItems": 1 }
        }
      }
    },
    "procedural": {
      "type": "object",
      "required": ["responseTimeMonths", "acknowledgementExpected", "canFileInEnglish", "notes"],
      "additionalProperties": false,
      "properties": {
        "responseTimeMonths":       { "type": "integer", "minimum": 1 },
        "acknowledgementExpected":  { "type": "boolean" },
        "canFileInEnglish":         { "type": "boolean" },
        "notes":                    { "type": "string" }
      }
    }
  }
}
